{
  "schemaVersion": "1.0",
  "sampleCount": 200,
  "elapsedSeconds": 0.177367,
  "throughputRequestsPerSecond": 1127.603,
  "latencyMs": {
    "p50": 3.262,
    "p95": 4.864,
    "p99": 6.681,
    "min": 2.006,
    "max": 17.514
  },
  "outcomes": {
    "success": 200
  },
  "statusCodes": {
    "200": 200
  },
  "errorCount": 0,
  "result": "PASS",
  "thresholds": {
    "maxP99Ms": 100
  },
  "generatedAt": "2026-09-09T13:16:30.241785Z",
  "environment": {
    "python": "3.12.14",
    "platform": "Windows-11-10.0.26200-SP0"
  },
  "target": {
    "scheme": "http",
    "host": "127.0.0.1"
  },
  "requests": 200,
  "concurrency": 4,
  "timeoutSeconds": 2.0,
  "maxResponseBytes": 1048576,
  "warmups": 10,
  "commit": "b373a15f1814061ea28e867d0f6c1369076a2359"
}
